{
  "$schema": "http://json-schema.org/draft-04/schema#",
  "type": "object",
  "description": "Describes a receiver",
  "title": "Receiver resource",
  "required": [
    "id",
    "version",
    "label",
    "description",
    "format",
    "caps",
    "tags",
    "device_id",
    "transport",
    "subscription"
  ],
  "properties": {
    "id": {
      "description": "Globally unique identifier for the Receiver",
      "type": "string",
      "pattern": "^[0-9a-f]{8}-[0-9a-f]{4}-[1-5][0-9a-f]{3}-[89ab][0-9a-f]{3}-[0-9a-f]{12}$"
    },
    "version": {
      "description": "String formatted PTP timestamp (<seconds>:<nanoseconds>) indicating precisely when an attribute of the resource last changed",
      "type": "string"
    },
    "label": {
      "description": "Freeform string label for the Receiver",
      "type": "string"
    },
    "description": {
      "description": "Detailed description of the Receiver",
      "type": "string"
    },
    "format": {
      "description": "Type of Flow accepted by the Receiver as a URN",
      "type": "string",
      "enum": [
        "urn:x-nmos:format:video",
        "urn:x-nmos:format:audio",
        "urn:x-nmos:format:data"
      ]
    },
    "caps": {
      "description": "Capabilities (not yet defined)",
      "type": "object"
    },
    "tags": {
      "description": "Key value set of freeform string tags to aid in filtering sources. Values should be represented as an array of strings. Can be empty.",
      "type": "object"
    },
    "device_id": {
      "description": "Device ID which this Receiver forms part of",
      "type": "string",
      "pattern": "^[0-9a-f]{8}-[0-9a-f]{4}-[1-5][0-9a-f]{3}-[89ab][0-9a-f]{3}-[0-9a-f]{12}$"
    },
    "transport": {
      "description": "Transport type accepted by the Receiver in URN format",
      "type": "string",
      "enum": [
        "urn:x-nmos:transport:rtp",
        "urn:x-nmos:transport:rtp.ucast",
        "urn:x-nmos:transport:rtp.mcast",
        "urn:x-nmos:transport:dash"
      ]
    },
    "subscription": {
      "description": "Object containing the 'sender_id' currently subscribed to. Sender_id should be null on initialisation.",
      "type": "object",
      "properties": {
        "sender_id": {
          "type": "string",
          "description": "UUID of the Sender that this Receiver is currently subscribed to",
          "pattern": "^[0-9a-f]{8}-[0-9a-f]{4}-[1-5][0-9a-f]{3}-[89ab][0-9a-f]{3}-[0-9a-f]{12}$",
          "default": null
        }
      }
    }
  }
}
