{
    "description": "",
    "format": "urn:x-nmos:format:video",
    "tags": {},
    "caps": {},
    "subscription": {
        "sender_id": "2683ad14-642f-459d-a169-ef91c76cec6b"
    },
    "version": "1441704532:450093308",
    "label": "RTPRx",
    "id": "1eb53d65-ac83-441c-86f6-9b27df30ef0c",
    "transport": "urn:x-nmos:transport:rtp",
    "device_id": "05017e08-b329-45f9-a566-a3f99cc11e4d"
}
