{
    "description": "RTP Receiver", 
    "tags": {
        "Location": [
            "Location 1"
        ]
    }, 
    "format": "urn:x-nmos:format:video", 
    "caps": {}, 
    "device_id": "0d0cb97e-b96a-4a39-887f-d491492d9081", 
    "version": "1441895693:480000000", 
    "label": "Viewer", 
    "id": "3350d113-1593-4271-a7f5-f4974415bb8e", 
    "transport": "urn:x-nmos:transport:rtp", 
    "subscription": {
        "sender_id": "55311762-8003-48fa-a645-0a0c7621ce45"
    }
}
